{
  "$id": "urn:codex-wire-audit:protocol:c126b0d8ef87fbcde2df7b9c40f24aa91b855758:responses_websocket_prewarm:1.0.0",
  "$schema": "https://json-schema.org/draft/2020-12/schema",
  "additionalProperties": false,
  "description": "WebSocket v2 prewarm request; generate=false suppresses model generation while establishing reusable state.",
  "properties": {
    "access_programs": {
      "type": "object"
    },
    "client_metadata": {
      "$ref": "urn:codex-wire-audit:protocol:c126b0d8ef87fbcde2df7b9c40f24aa91b855758:client_metadata_websocket:1.0.0"
    },
    "generate": {
      "const": false
    },
    "include": {
      "contains": {
        "const": "reasoning.encrypted_content"
      },
      "items": {
        "type": "string"
      },
      "minContains": 1,
      "type": "array"
    },
    "input": {
      "items": {
        "$ref": "urn:codex-wire-audit:protocol:c126b0d8ef87fbcde2df7b9c40f24aa91b855758:responses_item:1.0.0"
      },
      "type": "array"
    },
    "instructions": {
      "type": "string"
    },
    "model": {
      "minLength": 1,
      "type": "string"
    },
    "parallel_tool_calls": {
      "type": "boolean"
    },
    "previous_response_id": {
      "type": "string"
    },
    "prompt_cache_key": {
      "type": "string"
    },
    "reasoning": {
      "type": [
        "object",
        "null"
      ]
    },
    "service_tier": {
      "type": "string"
    },
    "store": {
      "const": false
    },
    "stream": {
      "const": true
    },
    "stream_options": {
      "type": "object"
    },
    "text": {
      "type": "object"
    },
    "tool_choice": {
      "const": "auto"
    },
    "tools": {
      "items": {
        "type": "object"
      },
      "type": [
        "array",
        "null"
      ]
    },
    "type": {
      "const": "response.create"
    }
  },
  "required": [
    "client_metadata",
    "generate",
    "model",
    "store",
    "stream",
    "type"
  ],
  "title": "Codex Responses WebSocket prewarm response.create message",
  "type": "object",
  "x-codex-wire-audit-certainty": "source_derived",
  "x-codex-wire-audit-entity": "schema.rust.responsecreatewsrequest",
  "x-codex-wire-audit-entity-refs": [],
  "x-codex-wire-audit-report-id": "urn:codex-wire-audit:openai_codex:c126b0d8ef87fbcde2df7b9c40f24aa91b855758",
  "x-codex-wire-audit-source-commit": "c126b0d8ef87fbcde2df7b9c40f24aa91b855758",
  "x-codex-wire-audit-validation-coverage": "structural"
}
